### ISSUE TITLE
ssl connection was reset by Apple push server.

### ISSUE THREAD

**Issue by xicilion** [ARMmbed/mbedtls#230]
```
lion-imac:ssl lion$ openssl s_client -host gateway.sandbox.push.apple.com -port 2195 -cert cert.pem -key key.pem
CONNECTED(00000003)
depth=1 /C=US/O=Entrust, Inc./OU=www.entrust.net/rpa is incorporated by reference/OU=(c) 2009 Entrust, Inc./CN=Entrust Certification Authority - L1C
verify error:num=20:unable to get local issuer certificate
verify return:0
---
Certificate chain
 0 s:/C=US/ST=California/L=Cupertino/O=Apple Inc./CN=gateway.sandbox.push.apple.com
   i:/C=US/O=Entrust, Inc./OU=www.entrust.net/rpa is incorporated by reference/OU=(c) 2009 Entrust, Inc./CN=Entrust Certification Authority - L1C
 1 s:/C=US/O=Entrust, Inc./OU=www.entrust.net/rpa is incorporated by reference/OU=(c) 2009 Entrust, Inc./CN=Entrust Certification Authority - L1C
   i:/O=Entrust.net/OU=www.entrust.net/CPS_2048 incorp. by ref. (limits liab.)/OU=(c) 1999 Entrust.net Limited/CN=Entrust.net Certification Authority (2048)
---
Server certificate
-----BEGIN CERTIFICATE-----
MIIFMzCCBBugAwIBAgIETCMmsDANBgkqhkiG9w0BAQUFADCBsTELMAkGA1UEBhMC
VVMxFjAUBgNVBAoTDUVudHJ1c3QsIEluYy4xOTA3BgNVBAsTMHd3dy5lbnRydXN0
Lm5ldC9ycGEgaXMgaW5jb3Jwb3JhdGVkIGJ5IHJlZmVyZW5jZTEfMB0GA1UECxMW
KGMpIDIwMDkgRW50cnVzdCwgSW5jLjEuMCwGA1UEAxMlRW50cnVzdCBDZXJ0aWZp
Y2F0aW9uIEF1dGhvcml0eSAtIEwxQzAeFw0xNDA1MjMxNzQyNDJaFw0xNjA1MjQw
NzA1MTNaMHQxCzAJBgNVBAYTAlVTMRMwEQYDVQQIEwpDYWxpZm9ybmlhMRIwEAYD
VQQHEwlDdXBlcnRpbm8xEzARBgNVBAoTCkFwcGxlIEluYy4xJzAlBgNVBAMTHmdh
dGV3YXkuc2FuZGJveC5wdXNoLmFwcGxlLmNvbTCCASIwDQYJKoZIhvcNAQEBBQAD
ggEPADCCAQoCggEBAOQpUlXpU3+LJ2XR01QdVooN7S9OFOINp3/tomPaenQAwFGo
qIakKFcN7AotWLFXFcR0QXKJkn4PL/zPKDBucyRFkc79S5+ZraGRISWfi7G8XeaG
G3GzgeVQ977Qrn0IdCswnbwLsJoErnmq4AveQajUbYueR9SxhkWBwMimSxXzXoOS
XUOPzRvzObCxVZrvBBDSRJCeNVnVxtCmb17DM3+z5GZatBwWnvw0jgvSQsgof+uC
idXgqcN4msv3tVH54ipmuD9kbbwvtnDCHBZRXMMmhUfFXZRuE8GBEbPfVkqB16ad
JV4TVrVxwFENwdnsX9CXavHCgFJhtHRWKOoCH48CAwEAAaOCAY0wggGJMAsGA1Ud
DwQEAwIFoDAdBgNVHSUEFjAUBggrBgEFBQcDAQYIKwYBBQUHAwIwMwYDVR0fBCww
KjAooCagJIYiaHR0cDovL2NybC5lbnRydXN0Lm5ldC9sZXZlbDFjLmNybDBkBggr
BgEFBQcBAQRYMFYwIwYIKwYBBQUHMAGGF2h0dHA6Ly9vY3NwLmVudHJ1c3QubmV0
MC8GCCsGAQUFBzAChiNodHRwOi8vYWlhLmVudHJ1c3QubmV0LzIwNDgtbDFjLmNl
cjBKBgNVHSAEQzBBMDUGCSqGSIb2fQdLAjAoMCYGCCsGAQUFBwIBFhpodHRwOi8v
d3d3LmVudHJ1c3QubmV0L3JwYTAIBgZngQwBAgIwKQYDVR0RBCIwIIIeZ2F0ZXdh
eS5zYW5kYm94LnB1c2guYXBwbGUuY29tMB8GA1UdIwQYMBaAFB7xq4kG+EkPATN3
7hR67hl8kyhNMB0GA1UdDgQWBBSSGfpGPmr9+FPcqRiStH0iKRBL7DAJBgNVHRME
AjAAMA0GCSqGSIb3DQEBBQUAA4IBAQAkj6+okMFVl7NHqQoii4e4iPDFiia+LmHX
BCc+2UEOOjilYWYoZ61oeqRXQ2b4Um3dT/LPmzMkKmgEt9epKNBLA6lSkL+IzEnF
wLQCHkL3BgvV20n5D8syzREV+8RKmSqiYmrF8dFq8cDcstu2joEKd173EfrymWW1
fMeaYTbjrn+vNkgM94+M4c/JnIDOhiPPbeAx9TESQZH+/6S98hrbuPIIlmaOJsOT
GMOUWeOTHXTCfGb1EM4SPVcyCW28TlWUBl8miqnsEO8g95jZZ25wFANlVxhfxBnP
fwUYU5NTM3h0xi3rIlXwAKD6zLKipcQ/YXRx7oMYnAm53tfU2MxV
-----END CERTIFICATE-----
subject=/C=US/ST=California/L=Cupertino/O=Apple Inc./CN=gateway.sandbox.push.apple.com
issuer=/C=US/O=Entrust, Inc./OU=www.entrust.net/rpa is incorporated by reference/OU=(c) 2009 Entrust, Inc./CN=Entrust Certification Authority - L1C
---
Acceptable client certificate CA names
/C=US/O=Apple Inc./OU=Apple Certification Authority/CN=Apple Root CA
/C=US/O=Apple Inc./OU=Apple Worldwide Developer Relations/CN=Apple Worldwide Developer Relations Certification Authority
/C=US/O=Apple Inc./OU=Apple Certification Authority/CN=Apple Application Integration Certification Authority
---
SSL handshake has read 3160 bytes and written 2136 bytes
---
New, TLSv1/SSLv3, Cipher is AES256-SHA
Server public key is 2048 bit
Secure Renegotiation IS supported
Compression: NONE
Expansion: NONE
SSL-Session:
    Protocol  : TLSv1
    Cipher    : AES256-SHA
    Session-ID:
    Session-ID-ctx:
    Master-Key: DFD68682D23F321112105A7CB5000FEBE6C19782779D0EB9457E5A19C98663860D4A45542809ACC946E801AEF6EDAB7C
    Key-Arg   : None
    Start Time: 1438392269
    Timeout   : 300 (sec)
    Verify return code: 0 (ok)
---

```
-------------------------------------------------------------------------------------------------------
```
lion-imac:ssl lion$ ./ssl_client2 server_name=gateway.sandbox.push.apple.com server_port=2195 crt_file=cert.pem key_file=key.pem

  . Seeding the random number generator... ok
  . Loading the CA root certificate ... ok (0 skipped)
  . Loading the client cert. and key... ok
  . Connecting to tcp/gateway.sandbox.push.apple.com/2195... ok
  . Setting up the SSL/TLS structure... ok
  . Performing the SSL/TLS handshake... failed
  ! mbedtls_ssl_handshake returned -0x7280

Last error was: -0x7280 - SSL - The connection indicated an EOF
```

**Comment by mpg** [comment]
Thanks for your report! We'll need more information if we want to have a chance to understand what's going on. Can you run the last command with debug_level=4 and show us the output? In addition, a tcpdump/wireshark trace of both transaction (the one that works, with OpenSSL, and the one that doesn't, with mbed TLS) could help.

**Comment by verdantyang** [comment]
@mpg  The follow one is the output with debug_level=4.
```
verdant:ssl verdant$ ./ssl_client2 server_name=gateway.sandbox.push.apple.com server_port=2195 crt_file=cert.pem key_file=key.pem debug_level=4

  . Seeding the random number generator... ok
  . Loading the CA root certificate ... ok (0 skipped)
  . Loading the client cert. and key... ok
  . Connecting to tcp/gateway.sandbox.push.apple.com/2195... ok
  . Setting up the SSL/TLS structure...ssl_tls.c:0084: |3| set_timer to 0 ms
 ok
  . Performing the SSL/TLS handshake...ssl_tls.c:5899: |2| => handshake
ssl_cli.c:2923: |2| client state: 0
ssl_tls.c:2413: |2| => flush output
ssl_tls.c:2425: |2| <= flush output
ssl_cli.c:2923: |2| client state: 1
ssl_tls.c:2413: |2| => flush output
ssl_tls.c:2425: |2| <= flush output
ssl_cli.c:0523: |2| => write client hello
ssl_cli.c:0561: |3| client hello, max version: [3:3]
ssl_cli.c:0499: |3| client hello, current time: 1438619194
ssl_cli.c:0570: |3| dumping 'client hello, random bytes' (32 bytes)
ssl_cli.c:0570: |3| 0000:  55 bf 96 3a f1 9a 7f 58 01 e9 23 a9 0e 04 50 72  U..:...X..#...Pr
ssl_cli.c:0570: |3| 0010:  49 64 72 c9 70 1e 92 ee 59 c7 de a2 ea 98 3c 74  Idr.p...Y.....<t
ssl_cli.c:0623: |3| client hello, session id len.: 0
ssl_cli.c:0624: |3| dumping 'client hello, session id' (0 bytes)
ssl_cli.c:0685: |3| client hello, add ciphersuite: 49196
...the operate of add ciphersuite...
ssl_cli.c:0718: |3| client hello, got 131 ciphersuites
ssl_cli.c:0749: |3| client hello, compress len.: 1
ssl_cli.c:0751: |3| client hello, compress alg.: 0
ssl_cli.c:0072: |3| client hello, adding server name extension: gateway.sandbox.push.apple.com
ssl_cli.c:0164: |3| client hello, adding signature_algorithms extension
ssl_cli.c:0229: |3| client hello, adding supported_elliptic_curves extension
ssl_cli.c:0268: |3| client hello, adding supported_point_formats extension
ssl_cli.c:0347: |3| client hello, adding encrypt_then_mac extension
ssl_cli.c:0373: |3| client hello, adding extended_master_secret extension
ssl_cli.c:0398: |3| client hello, adding session ticket extension
ssl_cli.c:0817: |3| client hello, total extension length: 119
ssl_tls.c:2698: |2| => write record
ssl_tls.c:2833: |3| output record: msgtype = 22, version = [3:1], msglen = 426
ssl_tls.c:2836: |4| dumping 'output record sent to network' (431 bytes)
ssl_tls.c:2836: |4| 0000:  16 03 01 01 aa 01 00 01 a6 03 03 55 bf 96 3a f1  ...........U..:.
ssl_tls.c:2836: |4| 0010:  9a 7f 58 01 e9 23 a9 0e 04 50 72 49 64 72 c9 70  ..X..#...PrIdr.p
ssl_tls.c:2836: |4| 0020:  1e 92 ee 59 c7 de a2 ea 98 3c 74 00 01 06 c0 2c  ...Y.....<t....,
ssl_tls.c:2836: |4| 0030:  c0 30 00 9f c0 ad c0 9f c0 24 c0 28 00 6b c0 0a  .0.......$.(.k..
ssl_tls.c:2836: |4| 0040:  c0 14 00 39 c0 af c0 a3 c0 87 c0 8b c0 7d c0 73  ...9.........}.s
ssl_tls.c:2836: |4| 0050:  c0 77 00 c4 00 88 c0 2b c0 2f 00 9e c0 ac c0 9e  .w.....+./......
ssl_tls.c:2836: |4| 0060:  c0 23 c0 27 00 67 c0 09 c0 13 00 33 c0 ae c0 a2  .#.'.g.....3....
ssl_tls.c:2836: |4| 0070:  c0 86 c0 8a c0 7c c0 72 c0 76 00 be 00 45 c0 08  .....|.r.v...E..
ssl_tls.c:2836: |4| 0080:  c0 12 00 16 00 ab c0 a7 c0 38 00 b3 c0 36 00 91  .........8...6..
ssl_tls.c:2836: |4| 0090:  c0 91 c0 9b c0 97 c0 ab 00 aa c0 a6 c0 37 00 b2  .............7..
ssl_tls.c:2836: |4| 00a0:  c0 35 00 90 c0 90 c0 96 c0 9a c0 aa c0 34 00 8f  .5...........4..
ssl_tls.c:2836: |4| 00b0:  00 9d c0 9d 00 3d 00 35 c0 32 c0 2a c0 0f c0 2e  .....=.5.2.*....
ssl_tls.c:2836: |4| 00c0:  c0 26 c0 05 c0 a1 c0 7b 00 c0 00 84 c0 8d c0 79  .&.....{.......y
ssl_tls.c:2836: |4| 00d0:  c0 89 c0 75 00 9c c0 9c 00 3c 00 2f c0 31 c0 29  ...u.....<./.1.)
ssl_tls.c:2836: |4| 00e0:  c0 0e c0 2d c0 25 c0 04 c0 a0 c0 7a 00 ba 00 41  ...-.%.....z...A
ssl_tls.c:2836: |4| 00f0:  c0 8c c0 78 c0 88 c0 74 00 0a c0 0d c0 03 00 ad  ...x...t........
ssl_tls.c:2836: |4| 0100:  00 b7 00 95 c0 93 c0 99 00 ac 00 b6 00 94 c0 92  ................
ssl_tls.c:2836: |4| 0110:  c0 98 00 93 00 a9 c0 a5 00 af 00 8d c0 8f c0 95  ................
ssl_tls.c:2836: |4| 0120:  c0 a9 00 a8 c0 a4 00 ae 00 8c c0 8e c0 94 c0 a8  ................
ssl_tls.c:2836: |4| 0130:  00 8b 00 ff 01 00 00 77 00 00 00 23 00 21 00 00  .......w...#.!..
ssl_tls.c:2836: |4| 0140:  1e 67 61 74 65 77 61 79 2e 73 61 6e 64 62 6f 78  .gateway.sandbox
ssl_tls.c:2836: |4| 0150:  2e 70 75 73 68 2e 61 70 70 6c 65 2e 63 6f 6d 00  .push.apple.com.
ssl_tls.c:2836: |4| 0160:  0d 00 1e 00 1c 06 03 06 01 05 03 05 01 04 03 04  ................
ssl_tls.c:2836: |4| 0170:  01 03 03 03 01 02 03 02 01 00 03 00 01 01 03 01  ................
ssl_tls.c:2836: |4| 0180:  01 00 0a 00 18 00 16 00 19 00 1c 00 18 00 1b 00  ................
ssl_tls.c:2836: |4| 0190:  17 00 16 00 1a 00 15 00 14 00 13 00 12 00 0b 00  ................
ssl_tls.c:2836: |4| 01a0:  02 01 00 00 16 00 00 00 17 00 00 00 23 00 00     ............#..
ssl_tls.c:2413: |2| => flush output
ssl_tls.c:2432: |2| message length: 431, out_left: 431
ssl_tls.c:2438: |2| ssl->f_send() returned 431 (-0xfffffe51)
ssl_tls.c:2457: |2| <= flush output
ssl_tls.c:2845: |2| <= write record
ssl_cli.c:0843: |2| <= write client hello
ssl_cli.c:2923: |2| client state: 2
ssl_tls.c:2413: |2| => flush output
ssl_tls.c:2425: |2| <= flush output
ssl_cli.c:1158: |2| => parse server hello
ssl_tls.c:3496: |2| => read record
ssl_tls.c:2205: |2| => fetch input
ssl_tls.c:2363: |2| in_left: 0, nb_want: 5
ssl_tls.c:2387: |2| in_left: 0, nb_want: 5
ssl_tls.c:2388: |2| ssl->f_recv(_timeout)() returned 0 (-0x0000)
ssl_tls.c:3527: |1| mbedtls_ssl_fetch_input() returned -29312 (-0x7280)
ssl_cli.c:1164: |1| mbedtls_ssl_read_record() returned -29312 (-0x7280)
ssl_tls.c:5909: |2| <= handshake
 failed
  ! mbedtls_ssl_handshake returned -0x7280

Last error was: -0x7280 - SSL - The connection indicated an EOF

ssl_tls.c:6614: |2| => free
ssl_tls.c:6679: |2| <= free
```

**Comment by verdantyang** [comment]
This part is the tcpdump of OpenSSL and  mbed TLS, Please help us find what's the problem is, thanks a lot.

```
The tcpdump of OpenSSL
00:36:32.817537 IP 192.168.1.10.58320 > 17.172.232.45.2195: Flags [S], seq 352822989, win 65535, options [mss 1460,nop,wscale 5,nop,nop,TS val 546389962 ecr 0,sackOK,eol], length 0
00:36:33.202106 IP 17.172.232.45.2195 > 192.168.1.10.58320: Flags [S.], seq 2686479162, ack 352822990, win 14480, options [mss 1410,sackOK,TS val 35425452 ecr 546389962,nop,wscale 7], length 0
00:36:33.202143 IP 192.168.1.10.58320 > 17.172.232.45.2195: Flags [.], ack 1, win 4106, options [nop,nop,TS val 546390346 ecr 35425452], length 0
00:36:33.202308 IP 192.168.1.10.58320 > 17.172.232.45.2195: Flags [P.], seq 1:131, ack 1, win 4106, options [nop,nop,TS val 546390346 ecr 35425452], length 130
00:36:33.476884 IP 17.172.232.45.2195 > 192.168.1.10.58320: Flags [.], ack 131, win 122, options [nop,nop,TS val 35425834 ecr 546390346], length 0
00:36:33.477404 IP 17.172.232.45.2195 > 192.168.1.10.58320: Flags [.], seq 1:1399, ack 131, win 122, options [nop,nop,TS val 35425834 ecr 546390346], length 1398
00:36:33.477961 IP 17.172.232.45.2195 > 192.168.1.10.58320: Flags [.], seq 1399:2797, ack 131, win 122, options [nop,nop,TS val 35425834 ecr 546390346], length 1398
00:36:33.477964 IP 17.172.232.45.2195 > 192.168.1.10.58320: Flags [P.], seq 2797:3102, ack 131, win 122, options [nop,nop,TS val 35425834 ecr 546390346], length 305
00:36:33.477988 IP 192.168.1.10.58320 > 17.172.232.45.2195: Flags [.], ack 2797, win 4052, options [nop,nop,TS val 546390619 ecr 35425834], length 0
00:36:33.478003 IP 192.168.1.10.58320 > 17.172.232.45.2195: Flags [.], ack 3102, win 4082, options [nop,nop,TS val 546390619 ecr 35425834], length 0
00:36:33.517923 IP 192.168.1.10.58320 > 17.172.232.45.2195: Flags [.], seq 131:1529, ack 3102, win 4096, options [nop,nop,TS val 546390658 ecr 35425834], length 1398
00:36:33.517929 IP 192.168.1.10.58320 > 17.172.232.45.2195: Flags [P.], seq 1529:2137, ack 3102, win 4096, options [nop,nop,TS val 546390658 ecr 35425834], length 608
00:36:33.807406 IP 17.172.232.45.2195 > 192.168.1.10.58320: Flags [.], ack 2137, win 166, options [nop,nop,TS val 35426150 ecr 546390658], length 0
00:36:33.807412 IP 17.172.232.45.2195 > 192.168.1.10.58320: Flags [P.], seq 3102:3161, ack 2137, win 166, options [nop,nop,TS val 35426156 ecr 546390658], length 59
00:36:33.807517 IP 192.168.1.10.58320 > 17.172.232.45.2195: Flags [.], ack 3161, win 4094, options [nop,nop,TS val 546390946 ecr 35426156], length 0
```

```
The tcpdump of mbed TLS
00:42:07.816972 IP 192.168.1.10.58332 > 17.172.232.18.2195: Flags [S], seq 553888677, win 65535, options [mss 1460,nop,wscale 5,nop,nop,TS val 546724711 ecr 0,sackOK,eol], length 0
00:42:08.099702 IP 17.172.232.18.2195 > 192.168.1.10.58332: Flags [S.], seq 1548877550, ack 553888678, win 14480, options [mss 1410,sackOK,TS val 3819595466 ecr 546724711,nop,wscale 7], length 0
00:42:08.099732 IP 192.168.1.10.58332 > 17.172.232.18.2195: Flags [.], ack 1, win 4106, options [nop,nop,TS val 546724993 ecr 3819595466], length 0
00:42:08.101283 IP 192.168.1.10.58332 > 17.172.232.18.2195: Flags [P.], seq 1:432, ack 1, win 4106, options [nop,nop,TS val 546724994 ecr 3819595466], length 431
00:42:08.373955 IP 17.172.232.18.2195 > 192.168.1.10.58332: Flags [.], ack 432, win 122, options [nop,nop,TS val 3819595743 ecr 546724994], length 0
00:42:08.374411 IP 17.172.232.18.2195 > 192.168.1.10.58332: Flags [F.], seq 1, ack 432, win 122, options [nop,nop,TS val 3819595743 ecr 546724994], length 0
00:42:08.374472 IP 192.168.1.10.58332 > 17.172.232.18.2195: Flags [.], ack 2, win 4106, options [nop,nop,TS val 546725266 ecr 3819595743], length 0
00:42:08.374683 IP 192.168.1.10.58332 > 17.172.232.18.2195: Flags [F.], seq 432, ack 2, win 4106, options [nop,nop,TS val 546725266 ecr 3819595743], length 0
00:42:08.768455 IP 17.172.232.18.2195 > 192.168.1.10.58332: Flags [.], ack 433, win 122, options [nop,nop,TS val 3819596020 ecr 546725266], length 0
```

**Comment by mpg** [comment]
Thanks! I'll investigate and get back to you. Please allow a few days for that.

**Comment by mpg** [comment]
Can you please test adding `force_ciphersuite=TLS-RSA-WITH-AES-256-CBC-SHA` to your ssl_client2 arguments? I suspect this might solve the issue.

**Comment by xicilion** [comment]
It works. thanks.

**Comment by xicilion** [comment]
It's also works with max_version=tls1_1 arguments.

**Comment by mpg** [comment]
I think one of their equipments might be sensitive to the length of the ClientHello. It is know that some SSL terminators choke on ClientHellos whose size is between 256 and 512 bytes, which was the case of the initial Hello here. Forcing to only one ciphersuite reduces the size, and forcing TLS 1.1 does the same, since if prevents all AEAD (GCM, CCM) suites from being used. In that case it doesn't reduce security as the server does not seem to support better than TLS 1.0 anyway.

**Comment by xicilion** [comment]
Apple push server only accept tls 1.0 and tls 1.1. connection will be reset when forcing ssl 3.0 or tls 1.2.

**Comment by TechAspirant** [comment]
Hello,

I am trying to connect Azure IOT hub over port number 8883 using mbetls in WinCE 6.0 but I am getting The connection indicates an EOF. I have added force_ciphersuite=TLS-RSA-WITH-AES-256-CBC-SHA as suggested .....Can View in my code below


#if !defined(MBEDTLS_CONFIG_FILE)
#include "mbedtls/config.h"
#else
#include MBEDTLS_CONFIG_FILE
#endif

#if defined(MBEDTLS_PLATFORM_C)
#include "mbedtls/platform.h"
#else
#include <stdio.h>
#include <stdlib.h>
#define mbedtls_time       time
#define mbedtls_time_t     time_t
#define mbedtls_printf     printf
#define mbedtls_fprintf    fprintf
#define mbedtls_snprintf   snprintf
#endif

#if !defined(MBEDTLS_ENTROPY_C) || \
    !defined(MBEDTLS_SSL_TLS_C) || !defined(MBEDTLS_SSL_CLI_C) || \
    !defined(MBEDTLS_NET_C) || !defined(MBEDTLS_CTR_DRBG_C)
int main( void )
{
    mbedtls_printf("MBEDTLS_ENTROPY_C and/or "
           "MBEDTLS_SSL_TLS_C and/or MBEDTLS_SSL_CLI_C and/or "
           "MBEDTLS_NET_C and/or MBEDTLS_CTR_DRBG_C and/or not defined.\n");
    return( 0 );
}
#else

#include "mbedtls/net_sockets.h"
#include "mbedtls/ssl.h"
#include "mbedtls/entropy.h"
#include "mbedtls/ctr_drbg.h"
#include "mbedtls/certs.h"
#include "mbedtls/x509.h"
#include "mbedtls/error.h"
#include "mbedtls/debug.h"
#include "mbedtls/timing.h"

#include <stdio.h>
#include <stdlib.h>
#include <string.h>
//msvcprt.lib
#define MAX_REQUEST_SIZE      10000
#define MAX_REQUEST_SIZE_STR "20000"

#define DFL_SERVER_NAME         "xxxxxxxx.azure-devices.net"
#define DFL_SERVER_ADDR         NULL
#define DFL_SERVER_PORT         "8883"
#define DFL_REQUEST_PAGE        "/devices/xxxx/messages/deviceBound?api-version=2016-11-14"
#define DFL_REQUEST_SIZE        -1
#define DFL_DEBUG_LEVEL         0
#define DFL_NBIO                0
#define DFL_READ_TIMEOUT        0
#define DFL_MAX_RESEND          0
#define DFL_CA_FILE             "\\FlashDisk\\rootCA.crt" //"\\FlashDisk\\rootCA.crt" //D:\\comodorsadomainvalidationsecureserverca.crt
#define DFL_CA_PATH             ""
#define DFL_CRT_FILE            "\\FlashDisk\\rootCA.crt"
#define DFL_KEY_FILE            "\\FlashDisk\\rootCA.key"
#define DFL_PSK                 ""
#define DFL_PSK_IDENTITY        "Client_identity"
#define DFL_ECJPAKE_PW          NULL
#define DFL_FORCE_CIPHER        0
#define DFL_RENEGOTIATION       MBEDTLS_SSL_RENEGOTIATION_ENABLED
#define DFL_ALLOW_LEGACY        -2
#define DFL_RENEGOTIATE         0
#define DFL_EXCHANGES           1
#define DFL_MIN_VERSION         -1
#define DFL_MAX_VERSION         -1
#define DFL_ARC4                -1
#define DFL_SHA1                -1
#define DFL_AUTH_MODE           -1
#define DFL_MFL_CODE            MBEDTLS_SSL_MAX_FRAG_LEN_NONE
#define DFL_TRUNC_HMAC          -1
#define DFL_RECSPLIT            -1
#define DFL_DHMLEN              -1
#define DFL_RECONNECT           0
#define DFL_RECO_DELAY          0
#define DFL_RECONNECT_HARD      0
#define DFL_TICKETS             MBEDTLS_SSL_SESSION_TICKETS_ENABLED
#define DFL_ALPN_STRING         NULL
#define DFL_CURVES              NULL
#define DFL_TRANSPORT           MBEDTLS_SSL_TRANSPORT_STREAM
#define DFL_HS_TO_MIN           0
#define DFL_HS_TO_MAX           0
#define DFL_FALLBACK            -1
#define DFL_EXTENDED_MS         -1
#define DFL_ETM                 -1

#define GET_REQUEST ""
#define GET_REQUEST_END "\r\n\r\n"

#if defined(MBEDTLS_X509_CRT_PARSE_C)
#if defined(MBEDTLS_FS_IO)
#define USAGE_IO \
    "    ca_file=%%s          The single file containing the top-level CA(s) you fully trust\n" \
    "                        default: \"\" (pre-loaded)\n" \
    "    ca_path=%%s          The path containing the top-level CA(s) you fully trust\n" \
    "                        default: \"\" (pre-loaded) (overrides ca_file)\n" \
    "    crt_file=%%s         Your own cert and chain (in bottom to top order, top may be omitted)\n" \
    "                        default: \"\" (pre-loaded)\n" \
    "    key_file=%%s         default: \"\" (pre-loaded)\n"
#else
#define USAGE_IO \
    "    No file operations available (MBEDTLS_FS_IO not defined)\n"
#endif /* MBEDTLS_FS_IO */
#else
#define USAGE_IO ""
#endif /* MBEDTLS_X509_CRT_PARSE_C */

#if defined(MBEDTLS_KEY_EXCHANGE__SOME__PSK_ENABLED)
#define USAGE_PSK                                                   \
    "    psk=%%s              default: \"\" (in hex, without 0x)\n" \
    "    psk_identity=%%s     default: \"Client_identity\"\n"
#else
#define USAGE_PSK ""
#endif /* MBEDTLS_KEY_EXCHANGE__SOME__PSK_ENABLED */

#if defined(MBEDTLS_SSL_SESSION_TICKETS)
#define USAGE_TICKETS                                       \
    "    tickets=%%d          default: 1 (enabled)\n"
#else
#define USAGE_TICKETS ""
#endif /* MBEDTLS_SSL_SESSION_TICKETS */

#if defined(MBEDTLS_SSL_TRUNCATED_HMAC)
#define USAGE_TRUNC_HMAC                                    \
    "    trunc_hmac=%%d       default: library default\n"
#else
#define USAGE_TRUNC_HMAC ""
#endif /* MBEDTLS_SSL_TRUNCATED_HMAC */

#if defined(MBEDTLS_SSL_MAX_FRAGMENT_LENGTH)
#define USAGE_MAX_FRAG_LEN                                      \
    "    max_frag_len=%%d     default: 16384 (tls default)\n"   \
    "                        options: 512, 1024, 2048, 4096\n"
#else
#define USAGE_MAX_FRAG_LEN ""
#endif /* MBEDTLS_SSL_MAX_FRAGMENT_LENGTH */

#if defined(MBEDTLS_SSL_CBC_RECORD_SPLITTING)
#define USAGE_RECSPLIT \
    "    recsplit=0/1        default: (library default: on)\n"
#else
#define USAGE_RECSPLIT
#endif

#if defined(MBEDTLS_DHM_C)
#define USAGE_DHMLEN \
    "    dhmlen=%%d           default: (library default: 1024 bits)\n"
#else
#define USAGE_DHMLEN
#endif

#if defined(MBEDTLS_SSL_ALPN)
#define USAGE_ALPN \
    "    alpn=%%s             default: \"\" (disabled)\n"   \
    "                        example: spdy/1,http/1.1\n"
#else
#define USAGE_ALPN ""
#endif /* MBEDTLS_SSL_ALPN */

#if defined(MBEDTLS_ECP_C)
#define USAGE_CURVES \
    "    curves=a,b,c,d      default: \"default\" (library default)\n"  \
    "                        example: \"secp521r1,brainpoolP512r1\"\n"  \
    "                        - use \"none\" for empty list\n"           \
    "                        - see mbedtls_ecp_curve_list()\n"          \
    "                          for acceptable curve names\n"
#else
#define USAGE_CURVES ""
#endif

#if defined(MBEDTLS_SSL_PROTO_DTLS)
#define USAGE_DTLS \
    "    dtls=%%d             default: 0 (TLS)\n"                           \
    "    hs_timeout=%%d-%%d    default: (library default: 1000-60000)\n"    \
    "                        range of DTLS handshake timeouts in millisecs\n"
#else
#define USAGE_DTLS ""
#endif

#if defined(MBEDTLS_SSL_FALLBACK_SCSV)
#define USAGE_FALLBACK \
    "    fallback=0/1        default: (library default: off)\n"
#else
#define USAGE_FALLBACK ""
#endif

#if defined(MBEDTLS_SSL_EXTENDED_MASTER_SECRET)
#define USAGE_EMS \
    "    extended_ms=0/1     default: (library default: on)\n"
#else
#define USAGE_EMS ""
#endif

#if defined(MBEDTLS_SSL_ENCRYPT_THEN_MAC)
#define USAGE_ETM \
    "    etm=0/1             default: (library default: on)\n"
#else
#define USAGE_ETM ""
#endif

#if defined(MBEDTLS_SSL_RENEGOTIATION)
#define USAGE_RENEGO \
    "    renegotiation=%%d    default: 0 (disabled)\n"      \
    "    renegotiate=%%d      default: 0 (disabled)\n"
#else
#define USAGE_RENEGO ""
#endif

#if defined(MBEDTLS_KEY_EXCHANGE_ECJPAKE_ENABLED)
#define USAGE_ECJPAKE \
    "    ecjpake_pw=%%s       default: none (disabled)\n"
#else
#define USAGE_ECJPAKE ""
#endif

#define USAGE \
    "\n usage: ssl_client2 param=<>...\n"                   \
    "\n acceptable parameters:\n"                           \
    "    server_name=%%s      default: localhost\n"         \
    "    server_addr=%%s      default: given by name\n"     \
    "    server_port=%%d      default: 4433\n"              \
    "    request_page=%%s     default: \".\"\n"             \
    "    request_size=%%d     default: about 34 (basic request)\n"           \
    "                        (minimum: 0, max: " MAX_REQUEST_SIZE_STR " )\n" \
    "    debug_level=%%d      default: 0 (disabled)\n"      \
    "    nbio=%%d             default: 0 (blocking I/O)\n"  \
    "                        options: 1 (non-blocking), 2 (added delays)\n" \
    "    read_timeout=%%d     default: 0 ms (no timeout)\n"    \
    "    max_resend=%%d       default: 0 (no resend on timeout)\n" \
    "\n"                                                    \
    USAGE_DTLS                                              \
    "\n"                                                    \
    "    auth_mode=%%s        default: (library default: none)\n"      \
    "                        options: none, optional, required\n" \
    USAGE_IO                                                \
    "\n"                                                    \
    USAGE_PSK                                               \
    USAGE_ECJPAKE                                           \
    "\n"                                                    \
    "    allow_legacy=%%d     default: (library default: no)\n"      \
    USAGE_RENEGO                                            \
    "    exchanges=%%d        default: 1\n"                 \
    "    reconnect=%%d        default: 0 (disabled)\n"      \
    "    reco_delay=%%d       default: 0 seconds\n"         \
    "    reconnect_hard=%%d   default: 0 (disabled)\n"      \
    USAGE_TICKETS                                           \
    USAGE_MAX_FRAG_LEN                                      \
    USAGE_TRUNC_HMAC                                        \
    USAGE_ALPN                                              \
    USAGE_FALLBACK                                          \
    USAGE_EMS                                               \
    USAGE_ETM                                               \
    USAGE_CURVES                                            \
    USAGE_RECSPLIT                                          \
    USAGE_DHMLEN                                            \
    "\n"                                                    \
    "    arc4=%%d             default: (library default: 0)\n" \
    "    allow_sha1=%%d       default: 0\n"                             \
    "    min_version=%%s      default: (library default: tls1)\n"       \
    "    max_version=%%s      default: (library default: tls1_2)\n"     \
    "    force_version=%%s    default: \"\" (none)\n"       \
    "                        options: ssl3, tls1, tls1_1, tls1_2, dtls1, dtls1_2\n" \
    "\n"                                                    \
    "    force_ciphersuite=TLS-RSA-WITH-AES-256-CBC-SHA\n"\
    " acceptable ciphersuite names:\n"

#define ALPN_LIST_SIZE  10
#define CURVE_LIST_SIZE 20

/*
 * global options
 */
struct options
{
	
    const char *server_name;    /* hostname of the server (client only)     */
    const char *server_addr;    /* address of the server (client only)      */
    const char *server_port;    /* port on which the ssl service runs       */
    int debug_level;            /* level of debugging                       */
    int nbio;                   /* should I/O be blocking?                  */
    uint32_t read_timeout;      /* timeout on mbedtls_ssl_read() in milliseconds    */
    int max_resend;             /* DTLS times to resend on read timeout     */
    const char *request_page;   /* page on server to request                */
    int request_size;           /* pad request with header to requested size */
    const char *ca_file;        /* the file with the CA certificate(s)      */
    const char *ca_path;        /* the path with the CA certificate(s) reside */
    const char *crt_file;       /* the file with the client certificate     */
    const char *key_file;       /* the file with the client key             */
    const char *psk;            /* the pre-shared key                       */
    const char *psk_identity;   /* the pre-shared key identity              */
    const char *ecjpake_pw;     /* the EC J-PAKE password                   */
    int force_ciphersuite[2];   /* protocol/ciphersuite to use, or all      */
    int renegotiation;          /* enable / disable renegotiation           */
    int allow_legacy;           /* allow legacy renegotiation               */
    int renegotiate;            /* attempt renegotiation?                   */
    int renego_delay;           /* delay before enforcing renegotiation     */
    int exchanges;              /* number of data exchanges                 */
    int min_version;            /* minimum protocol version accepted        */
    int max_version;            /* maximum protocol version accepted        */
    int arc4;                   /* flag for arc4 suites support             */
    int allow_sha1;             /* flag for SHA-1 support                   */
    int auth_mode;              /* verify mode for connection               */
    unsigned char mfl_code;     /* code for maximum fragment length         */
    int trunc_hmac;             /* negotiate truncated hmac or not          */
    int recsplit;               /* enable record splitting?                 */
    int dhmlen;                 /* minimum DHM params len in bits           */
    int reconnect;              /* attempt to resume session                */
    int reco_delay;             /* delay in seconds before resuming session */
    int reconnect_hard;         /* unexpectedly reconnect from the same port */
    int tickets;                /* enable / disable session tickets         */
    const char *curves;         /* list of supported elliptic curves        */
    const char *alpn_string;    /* ALPN supported protocols                 */
    int transport;              /* TLS or DTLS?                             */
    uint32_t hs_to_min;         /* Initial value of DTLS handshake timer    */
    uint32_t hs_to_max;         /* Max value of DTLS handshake timer        */
    int fallback;               /* is this a fallback connection?           */
    int extended_ms;            /* negotiate extended master secret?        */
    int etm;                    /* negotiate encrypt then mac?              */
} opt;

static void my_debug( void *ctx, int level,
                      const char *file, int line,
                      const char *str )
{
    const char *p, *basename;

    /* Extract basename from file */
    for( p = basename = file; *p != '\0'; p++ )
        if( *p == '/' || *p == '\\' )
            basename = p + 1;

    mbedtls_fprintf( (FILE *) ctx, "%s:%04d: |%d| %s", basename, line, level, str );
    fflush(  (FILE *) ctx  );
}

/*
 * Test recv/send functions that make sure each try returns
 * WANT_READ/WANT_WRITE at least once before sucesseding
 */
static int my_recv( void *ctx, unsigned char *buf, size_t len )
{
    static int first_try = 1;
    int ret;

    if( first_try )
    {
        first_try = 0;
        return( MBEDTLS_ERR_SSL_WANT_READ );
    }

    ret = mbedtls_net_recv( ctx, buf, len );
    if( ret != MBEDTLS_ERR_SSL_WANT_READ )
        first_try = 1; /* Next call will be a new operation */
    return( ret );
}

static int my_send( void *ctx, const unsigned char *buf, size_t len )
{
    static int first_try = 1;
    int ret;

    if( first_try )
    {
        first_try = 0;
        return( MBEDTLS_ERR_SSL_WANT_WRITE );
    }

    ret = mbedtls_net_send( ctx, buf, len );
    if( ret != MBEDTLS_ERR_SSL_WANT_WRITE )
        first_try = 1; /* Next call will be a new operation */
    return( ret );
}

#if defined(MBEDTLS_X509_CRT_PARSE_C)
/*
 * Enabled if debug_level > 1 in code below
 */
static int my_verify( void *data, mbedtls_x509_crt *crt, int depth, uint32_t *flags )
{
    char buf[1024];
    ((void) data);

    mbedtls_printf( "\nVerify requested for (Depth %d):\n", depth );
    mbedtls_x509_crt_info( buf, sizeof( buf ) - 1, "", crt );
    mbedtls_printf( "%s", buf );

    if ( ( *flags ) == 0 )
        mbedtls_printf( "  This certificate has no flags\n" );
    else
    {
        mbedtls_x509_crt_verify_info( buf, sizeof( buf ), "  ! ", *flags );
        mbedtls_printf( "%s\n", buf );
    }

    return( 0 );
}

static int ssl_sig_hashes_for_test[] = {
#if defined(MBEDTLS_SHA512_C)
    MBEDTLS_MD_SHA512,
    MBEDTLS_MD_SHA384,
#endif
#if defined(MBEDTLS_SHA256_C)
    MBEDTLS_MD_SHA256,
    MBEDTLS_MD_SHA224,
#endif
#if defined(MBEDTLS_SHA1_C)
    /* Allow SHA-1 as we use it extensively in tests. */
    MBEDTLS_MD_SHA1,
#endif
    MBEDTLS_MD_NONE
};
#endif /* MBEDTLS_X509_CRT_PARSE_C */

int main( int argc, char *argv[] )
{
	char *Temp;
    int ret = 0, len, tail_len, i, written, frags, retry_left;
    mbedtls_net_context server_fd;

    char buf[MAX_REQUEST_SIZE + 1];

#if defined(MBEDTLS_KEY_EXCHANGE__SOME__PSK_ENABLED)
    unsigned char psk[MBEDTLS_PSK_MAX_LEN];
    size_t psk_len = 0;
#endif
#if defined(MBEDTLS_SSL_ALPN)
    const char *alpn_list[ALPN_LIST_SIZE];
#endif
#if defined(MBEDTLS_ECP_C)
    mbedtls_ecp_group_id curve_list[CURVE_LIST_SIZE];
    const mbedtls_ecp_curve_info *curve_cur;
#endif

    const char *pers = "ssl_client2";

#if defined(MBEDTLS_X509_CRT_PARSE_C)
    mbedtls_x509_crt_profile crt_profile_for_test = mbedtls_x509_crt_profile_default;
#endif
    mbedtls_entropy_context entropy;
    mbedtls_ctr_drbg_context ctr_drbg;
    mbedtls_ssl_context ssl;
    mbedtls_ssl_config conf;
    mbedtls_ssl_session saved_session;
#if defined(MBEDTLS_TIMING_C)
    mbedtls_timing_delay_context timer;
#endif
#if defined(MBEDTLS_X509_CRT_PARSE_C)
    uint32_t flags;
    mbedtls_x509_crt cacert;
    mbedtls_x509_crt clicert;
    mbedtls_pk_context pkey;
#endif
    char *p, *q;
    const int *list;

    /*
     * Make sure memory references are valid.
     */
    mbedtls_net_init( &server_fd );
    mbedtls_ssl_init( &ssl );
    mbedtls_ssl_config_init( &conf );
    memset( &saved_session, 0, sizeof( mbedtls_ssl_session ) );
    mbedtls_ctr_drbg_init( &ctr_drbg );
#if defined(MBEDTLS_X509_CRT_PARSE_C)
    mbedtls_x509_crt_init( &cacert );
    mbedtls_x509_crt_init( &clicert );
    mbedtls_pk_init( &pkey );
#endif
#if defined(MBEDTLS_SSL_ALPN)
    memset( (void * ) alpn_list, 0, sizeof( alpn_list ) );
#endif

    if( argc == 0 )
    {
    usage:
        if( ret == 0 )
            ret = 1;

        mbedtls_printf( USAGE );

        list = mbedtls_ssl_list_ciphersuites();
        while( *list )
        {
            mbedtls_printf(" %-42s", mbedtls_ssl_get_ciphersuite_name( *list ) );
            list++;
            if( !*list )
                break;
            mbedtls_printf(" %s\n", mbedtls_ssl_get_ciphersuite_name( *list ) );
            list++;
        }
        mbedtls_printf("\n");
        goto exit;
    }

    opt.server_name         = DFL_SERVER_NAME;
    opt.server_addr         = DFL_SERVER_ADDR;
    opt.server_port         = DFL_SERVER_PORT;
    opt.debug_level         = DFL_DEBUG_LEVEL;
    opt.nbio                = DFL_NBIO;
    opt.read_timeout        = DFL_READ_TIMEOUT;
    opt.max_resend          = DFL_MAX_RESEND;
    opt.request_page        = DFL_REQUEST_PAGE;
    opt.request_size        = DFL_REQUEST_SIZE;
    opt.ca_file             = DFL_CA_FILE;
    opt.ca_path             = DFL_CA_PATH;
    opt.crt_file            = DFL_CRT_FILE;
    opt.key_file            = DFL_KEY_FILE;
    opt.psk                 = DFL_PSK;
    opt.psk_identity        = DFL_PSK_IDENTITY;
    opt.ecjpake_pw          = DFL_ECJPAKE_PW;
    opt.force_ciphersuite[0]= DFL_FORCE_CIPHER;
    opt.renegotiation       = DFL_RENEGOTIATION;
    opt.allow_legacy        = DFL_ALLOW_LEGACY;
    opt.renegotiate         = DFL_RENEGOTIATE;
    opt.exchanges           = DFL_EXCHANGES;
    opt.min_version         = DFL_MIN_VERSION;
    opt.max_version         = DFL_MAX_VERSION;
    opt.arc4                = DFL_ARC4;
    opt.allow_sha1          = DFL_SHA1;
    opt.auth_mode           = DFL_AUTH_MODE;
    opt.mfl_code            = DFL_MFL_CODE;
    opt.trunc_hmac          = DFL_TRUNC_HMAC;
    opt.recsplit            = DFL_RECSPLIT;
    opt.dhmlen              = DFL_DHMLEN;
    opt.reconnect           = DFL_RECONNECT;
    opt.reco_delay          = DFL_RECO_DELAY;
    opt.reconnect_hard      = DFL_RECONNECT_HARD;
    opt.tickets             = DFL_TICKETS;
    opt.alpn_string         = DFL_ALPN_STRING;
    opt.curves              = DFL_CURVES;
    opt.transport           = DFL_TRANSPORT;
    opt.hs_to_min           = DFL_HS_TO_MIN;
    opt.hs_to_max           = DFL_HS_TO_MAX;
    opt.fallback            = DFL_FALLBACK;
    opt.extended_ms         = DFL_EXTENDED_MS;
    opt.etm                 = DFL_ETM;

    for( i = 1; i < argc; i++ )
    {
        p = argv[i];
        if( ( q = strchr( p, '=' ) ) == NULL )
            goto usage;
        *q++ = '\0';

        if( strcmp( p, "server_name" ) == 0 )
            opt.server_name = q;
        else if( strcmp( p, "server_addr" ) == 0 )
            opt.server_addr = q;
        else if( strcmp( p, "server_port" ) == 0 )
            opt.server_port = q;
        else if( strcmp( p, "dtls" ) == 0 )
        {
            int t = atoi( q );
            if( t == 0 )
                opt.transport = MBEDTLS_SSL_TRANSPORT_STREAM;
            else if( t == 1 )
                opt.transport = MBEDTLS_SSL_TRANSPORT_DATAGRAM;
            else
                goto usage;
        }
        else if( strcmp( p, "debug_level" ) == 0 )
        {
            opt.debug_level = atoi( q );
            if( opt.debug_level < 0 || opt.debug_level > 65535 )
                goto usage;
        }
        else if( strcmp( p, "nbio" ) == 0 )
        {
            opt.nbio = atoi( q );
            if( opt.nbio < 0 || opt.nbio > 2 )
                goto usage;
        }
        else if( strcmp( p, "read_timeout" ) == 0 )
            opt.read_timeout = atoi( q );
        else if( strcmp( p, "max_resend" ) == 0 )
        {
            opt.max_resend = atoi( q );
            if( opt.max_resend < 0 )
                goto usage;
        }
        else if( strcmp( p, "request_page" ) == 0 )
            opt.request_page = q;
        else if( strcmp( p, "request_size" ) == 0 )
        {
            opt.request_size = atoi( q );
            if( opt.request_size < 0 ||
                opt.request_size > MAX_REQUEST_SIZE )
                goto usage;
        }
        else if( strcmp( p, "ca_file" ) == 0 )
            opt.ca_file = q;
        else if( strcmp( p, "ca_path" ) == 0 )
            opt.ca_path = q;
        else if( strcmp( p, "crt_file" ) == 0 )
            opt.crt_file = q;
        else if( strcmp( p, "key_file" ) == 0 )
            opt.key_file = q;
        else if( strcmp( p, "psk" ) == 0 )
            opt.psk = q;
        else if( strcmp( p, "psk_identity" ) == 0 )
            opt.psk_identity = q;
        else if( strcmp( p, "ecjpake_pw" ) == 0 )
            opt.ecjpake_pw = q;
        else if( strcmp( p, "force_ciphersuite" ) == 0 )
        {
            opt.force_ciphersuite[0] = mbedtls_ssl_get_ciphersuite_id( q );

            if( opt.force_ciphersuite[0] == 0 )
            {
                ret = 2;
                goto usage;
            }
            opt.force_ciphersuite[1] = 0;
        }
        else if( strcmp( p, "renegotiation" ) == 0 )
        {
            opt.renegotiation = (atoi( q )) ? MBEDTLS_SSL_RENEGOTIATION_ENABLED :
                                              MBEDTLS_SSL_RENEGOTIATION_DISABLED;
        }
        else if( strcmp( p, "allow_legacy" ) == 0 )
        {
            switch( atoi( q ) )
            {
                case -1: opt.allow_legacy = MBEDTLS_SSL_LEGACY_BREAK_HANDSHAKE; break;
                case 0:  opt.allow_legacy = MBEDTLS_SSL_LEGACY_NO_RENEGOTIATION; break;
                case 1:  opt.allow_legacy = MBEDTLS_SSL_LEGACY_ALLOW_RENEGOTIATION; break;
                default: goto usage;
            }
        }
        else if( strcmp( p, "renegotiate" ) == 0 )
        {
            opt.renegotiate = atoi( q );
            if( opt.renegotiate < 0 || opt.renegotiate > 1 )
                goto usage;
        }
        else if( strcmp( p, "exchanges" ) == 0 )
        {
            opt.exchanges = atoi( q );
            if( opt.exchanges < 1 )
                goto usage;
        }
        else if( strcmp( p, "reconnect" ) == 0 )
        {
            opt.reconnect = atoi( q );
            if( opt.reconnect < 0 || opt.reconnect > 2 )
                goto usage;
        }
        else if( strcmp( p, "reco_delay" ) == 0 )
        {
            opt.reco_delay = atoi( q );
            if( opt.reco_delay < 0 )
                goto usage;
        }
        else if( strcmp( p, "reconnect_hard" ) == 0 )
        {
            opt.reconnect_hard = atoi( q );
            if( opt.reconnect_hard < 0 || opt.reconnect_hard > 1 )
                goto usage;
        }
        else if( strcmp( p, "tickets" ) == 0 )
        {
            opt.tickets = atoi( q );
            if( opt.tickets < 0 || opt.tickets > 2 )
                goto usage;
        }
        else if( strcmp( p, "alpn" ) == 0 )
        {
            opt.alpn_string = q;
        }
        else if( strcmp( p, "fallback" ) == 0 )
        {
            switch( atoi( q ) )
            {
                case 0: opt.fallback = MBEDTLS_SSL_IS_NOT_FALLBACK; break;
                case 1: opt.fallback = MBEDTLS_SSL_IS_FALLBACK; break;
                default: goto usage;
            }
        }
        else if( strcmp( p, "extended_ms" ) == 0 )
        {
            switch( atoi( q ) )
            {
                case 0: opt.extended_ms = MBEDTLS_SSL_EXTENDED_MS_DISABLED; break;
                case 1: opt.extended_ms = MBEDTLS_SSL_EXTENDED_MS_ENABLED; break;
                default: goto usage;
            }
        }
        else if( strcmp( p, "curves" ) == 0 )
            opt.curves = q;
        else if( strcmp( p, "etm" ) == 0 )
        {
            switch( atoi( q ) )
            {
                case 0: opt.etm = MBEDTLS_SSL_ETM_DISABLED; break;
                case 1: opt.etm = MBEDTLS_SSL_ETM_ENABLED; break;
                default: goto usage;
            }
        }
        else if( strcmp( p, "min_version" ) == 0 )
        {
            if( strcmp( q, "ssl3" ) == 0 )
                opt.min_version = MBEDTLS_SSL_MINOR_VERSION_0;
            else if( strcmp( q, "tls1" ) == 0 )
                opt.min_version = MBEDTLS_SSL_MINOR_VERSION_1;
            else if( strcmp( q, "tls1_1" ) == 0 ||
                     strcmp( q, "dtls1" ) == 0 )
                opt.min_version = MBEDTLS_SSL_MINOR_VERSION_2;
            else if( strcmp( q, "tls1_2" ) == 0 ||
                     strcmp( q, "dtls1_2" ) == 0 )
                opt.min_version = MBEDTLS_SSL_MINOR_VERSION_3;
            else
                goto usage;
        }
        else if( strcmp( p, "max_version" ) == 0 )
        {
            if( strcmp( q, "ssl3" ) == 0 )
                opt.max_version = MBEDTLS_SSL_MINOR_VERSION_0;
            else if( strcmp( q, "tls1" ) == 0 )
                opt.max_version = MBEDTLS_SSL_MINOR_VERSION_1;
            else if( strcmp( q, "tls1_1" ) == 0 ||
                     strcmp( q, "dtls1" ) == 0 )
                opt.max_version = MBEDTLS_SSL_MINOR_VERSION_2;
            else if( strcmp( q, "tls1_2" ) == 0 ||
                     strcmp( q, "dtls1_2" ) == 0 )
                opt.max_version = MBEDTLS_SSL_MINOR_VERSION_3;
            else
                goto usage;
        }
        else if( strcmp( p, "arc4" ) == 0 )
        {
            switch( atoi( q ) )
            {
                case 0:     opt.arc4 = MBEDTLS_SSL_ARC4_DISABLED;   break;
                case 1:     opt.arc4 = MBEDTLS_SSL_ARC4_ENABLED;    break;
                default:    goto usage;
            }
        }
        else if( strcmp( p, "allow_sha1" ) == 0 )
        {
            switch( atoi( q ) )
            {
                case 0:     opt.allow_sha1 = 0;   break;
                case 1:     opt.allow_sha1 = 1;    break;
                default:    goto usage;
            }
        }
        else if( strcmp( p, "force_version" ) == 0 )
        {
            if( strcmp( q, "ssl3" ) == 0 )
            {
                opt.min_version = MBEDTLS_SSL_MINOR_VERSION_0;
                opt.max_version = MBEDTLS_SSL_MINOR_VERSION_0;
            }
            else if( strcmp( q, "tls1" ) == 0 )
            {
                opt.min_version = MBEDTLS_SSL_MINOR_VERSION_1;
                opt.max_version = MBEDTLS_SSL_MINOR_VERSION_1;
            }
            else if( strcmp( q, "tls1_1" ) == 0 )
            {
                opt.min_version = MBEDTLS_SSL_MINOR_VERSION_2;
                opt.max_version = MBEDTLS_SSL_MINOR_VERSION_2;
            }
            else if( strcmp( q, "tls1_2" ) == 0 )
            {
                opt.min_version = MBEDTLS_SSL_MINOR_VERSION_3;
                opt.max_version = MBEDTLS_SSL_MINOR_VERSION_3;
            }
            else if( strcmp( q, "dtls1" ) == 0 )
            {
                opt.min_version = MBEDTLS_SSL_MINOR_VERSION_2;
                opt.max_version = MBEDTLS_SSL_MINOR_VERSION_2;
                opt.transport = MBEDTLS_SSL_TRANSPORT_DATAGRAM;
            }
            else if( strcmp( q, "dtls1_2" ) == 0 )
            {
                opt.min_version = MBEDTLS_SSL_MINOR_VERSION_3;
                opt.max_version = MBEDTLS_SSL_MINOR_VERSION_3;
                opt.transport = MBEDTLS_SSL_TRANSPORT_DATAGRAM;
            }
            else
                goto usage;
        }
        else if( strcmp( p, "auth_mode" ) == 0 )
        {
            if( strcmp( q, "none" ) == 0 )
                opt.auth_mode = MBEDTLS_SSL_VERIFY_NONE;
            else if( strcmp( q, "optional" ) == 0 )
                opt.auth_mode = MBEDTLS_SSL_VERIFY_OPTIONAL;
            else if( strcmp( q, "required" ) == 0 )
                opt.auth_mode = MBEDTLS_SSL_VERIFY_REQUIRED;
            else
                goto usage;
        }
        else if( strcmp( p, "max_frag_len" ) == 0 )
        {
            if( strcmp( q, "512" ) == 0 )
                opt.mfl_code = MBEDTLS_SSL_MAX_FRAG_LEN_512;
            else if( strcmp( q, "1024" ) == 0 )
                opt.mfl_code = MBEDTLS_SSL_MAX_FRAG_LEN_1024;
            else if( strcmp( q, "2048" ) == 0 )
                opt.mfl_code = MBEDTLS_SSL_MAX_FRAG_LEN_2048;
            else if( strcmp( q, "4096" ) == 0 )
                opt.mfl_code = MBEDTLS_SSL_MAX_FRAG_LEN_4096;
            else
                goto usage;
        }
        else if( strcmp( p, "trunc_hmac" ) == 0 )
        {
            switch( atoi( q ) )
            {
                case 0: opt.trunc_hmac = MBEDTLS_SSL_TRUNC_HMAC_DISABLED; break;
                case 1: opt.trunc_hmac = MBEDTLS_SSL_TRUNC_HMAC_ENABLED; break;
                default: goto usage;
            }
        }
        else if( strcmp( p, "hs_timeout" ) == 0 )
        {
            if( ( p = strchr( q, '-' ) ) == NULL )
                goto usage;
            *p++ = '\0';
            opt.hs_to_min = atoi( q );
            opt.hs_to_max = atoi( p );
            if( opt.hs_to_min == 0 || opt.hs_to_max < opt.hs_to_min )
                goto usage;
        }
        else if( strcmp( p, "recsplit" ) == 0 )
        {
            opt.recsplit = atoi( q );
            if( opt.recsplit < 0 || opt.recsplit > 1 )
                goto usage;
        }
        else if( strcmp( p, "dhmlen" ) == 0 )
        {
            opt.dhmlen = atoi( q );
            if( opt.dhmlen < 0 )
                goto usage;
        }
        else
            goto usage;
    }

#if defined(MBEDTLS_DEBUG_C)
    mbedtls_debug_set_threshold( opt.debug_level );
#endif

    if( opt.force_ciphersuite[0] > 0 )
    {
        const mbedtls_ssl_ciphersuite_t *ciphersuite_info;
        ciphersuite_info = mbedtls_ssl_ciphersuite_from_id( opt.force_ciphersuite[0] );

        if( opt.max_version != -1 &&
            ciphersuite_info->min_minor_ver > opt.max_version )
        {
            mbedtls_printf("forced ciphersuite not allowed with this protocol version\n");
            ret = 2;
            goto usage;
        }
        if( opt.min_version != -1 &&
            ciphersuite_info->max_minor_ver < opt.min_version )
        {
            mbedtls_printf("forced ciphersuite not allowed with this protocol version\n");
            ret = 2;
            goto usage;
        }

        /* If the server selects a version that's not supported by
         * this suite, then there will be no common ciphersuite... */
        if( opt.max_version == -1 ||
            opt.max_version > ciphersuite_info->max_minor_ver )
        {
            opt.max_version = ciphersuite_info->max_minor_ver;
        }
        if( opt.min_version < ciphersuite_info->min_minor_ver )
        {
            opt.min_version = ciphersuite_info->min_minor_ver;
            /* DTLS starts with TLS 1.1 */
            if( opt.transport == MBEDTLS_SSL_TRANSPORT_DATAGRAM &&
                opt.min_version < MBEDTLS_SSL_MINOR_VERSION_2 )
                opt.min_version = MBEDTLS_SSL_MINOR_VERSION_2;
        }

        /* Enable RC4 if needed and not explicitly disabled */
        if( ciphersuite_info->cipher == MBEDTLS_CIPHER_ARC4_128 )
        {
            if( opt.arc4 == MBEDTLS_SSL_ARC4_DISABLED )
            {
                mbedtls_printf("forced RC4 ciphersuite with RC4 disabled\n");
                ret = 2;
                goto usage;
            }

            opt.arc4 = MBEDTLS_SSL_ARC4_ENABLED;
        }
    }

#if defined(MBEDTLS_KEY_EXCHANGE__SOME__PSK_ENABLED)
    /*
     * Unhexify the pre-shared key if any is given
     */
    if( strlen( opt.psk ) )
    {
        unsigned char c;
        size_t j;

        if( strlen( opt.psk ) % 2 != 0 )
        {
            mbedtls_printf("pre-shared key not valid hex\n");
            goto exit;
        }

        psk_len = strlen( opt.psk ) / 2;

        for( j = 0; j < strlen( opt.psk ); j += 2 )
        {
            c = opt.psk[j];
            if( c >= '0' && c <= '9' )
                c -= '0';
            else if( c >= 'a' && c <= 'f' )
                c -= 'a' - 10;
            else if( c >= 'A' && c <= 'F' )
                c -= 'A' - 10;
            else
            {
                mbedtls_printf("pre-shared key not valid hex\n");
                goto exit;
            }
            psk[ j / 2 ] = c << 4;

            c = opt.psk[j + 1];
            if( c >= '0' && c <= '9' )
                c -= '0';
            else if( c >= 'a' && c <= 'f' )
                c -= 'a' - 10;
            else if( c >= 'A' && c <= 'F' )
                c -= 'A' - 10;
            else
            {
                mbedtls_printf("pre-shared key not valid hex\n");
                goto exit;
            }
            psk[ j / 2 ] |= c;
        }
    }
#endif /* MBEDTLS_KEY_EXCHANGE__SOME__PSK_ENABLED */

#if defined(MBEDTLS_ECP_C)
    if( opt.curves != NULL )
    {
        p = (char *) opt.curves;
        i = 0;

        if( strcmp( p, "none" ) == 0 )
        {
            curve_list[0] = MBEDTLS_ECP_DP_NONE;
        }
        else if( strcmp( p, "default" ) != 0 )
        {
            /* Leave room for a final NULL in curve list */
            while( i < CURVE_LIST_SIZE - 1 && *p != '\0' )
            {
                q = p;

                /* Terminate the current string */
                while( *p != ',' && *p != '\0' )
                    p++;
                if( *p == ',' )
                    *p++ = '\0';

                if( ( curve_cur = mbedtls_ecp_curve_info_from_name( q ) ) != NULL )
                {
                    curve_list[i++] = curve_cur->grp_id;
                }
                else
                {
                    mbedtls_printf( "unknown curve %s\n", q );
                    mbedtls_printf( "supported curves: " );
                    for( curve_cur = mbedtls_ecp_curve_list();
                         curve_cur->grp_id != MBEDTLS_ECP_DP_NONE;
                         curve_cur++ )
                    {
                        mbedtls_printf( "%s ", curve_cur->name );
                    }
                    mbedtls_printf( "\n" );
                    goto exit;
                }
            }

            mbedtls_printf("Number of curves: %d\n", i );

            if( i == CURVE_LIST_SIZE - 1 && *p != '\0' )
            {
                mbedtls_printf( "curves list too long, maximum %d",
                                CURVE_LIST_SIZE - 1 );
                goto exit;
            }

            curve_list[i] = MBEDTLS_ECP_DP_NONE;
        }
    }
#endif /* MBEDTLS_ECP_C */

#if defined(MBEDTLS_SSL_ALPN)
    if( opt.alpn_string != NULL )
    {
        p = (char *) opt.alpn_string;
        i = 0;

        /* Leave room for a final NULL in alpn_list */
        while( i < ALPN_LIST_SIZE - 1 && *p != '\0' )
        {
            alpn_list[i++] = p;

            /* Terminate the current string and move on to next one */
            while( *p != ',' && *p != '\0' )
                p++;
            if( *p == ',' )
                *p++ = '\0';
        }
    }
#endif /* MBEDTLS_SSL_ALPN */

    /*
     * 0. Initialize the RNG and the session data
     */
    mbedtls_printf( "\n  . Seeding the random number generator..." );
    fflush( stdout );

    mbedtls_entropy_init( &entropy );
    if( ( ret = mbedtls_ctr_drbg_seed( &ctr_drbg, mbedtls_entropy_func, &entropy,
                               (const unsigned char *) pers,
                               strlen( pers ) ) ) != 0 )
    {
        mbedtls_printf( " failed\n  ! mbedtls_ctr_drbg_seed returned -0x%x\n", -ret );
       // goto exit;
    }

    mbedtls_printf( " ok\n" );

#if defined(MBEDTLS_X509_CRT_PARSE_C)
    /*
     * 1.1. Load the trusted CA
     */
    mbedtls_printf( "  . Loading the CA root certificate ..." );
    fflush( stdout );

#if defined(MBEDTLS_FS_IO)
    if( strlen( opt.ca_path ) )
        if( strcmp( opt.ca_path, "none" ) == 0 )
            ret = 0;
        else
            ret = mbedtls_x509_crt_parse_path( &cacert, opt.ca_path );
    else if( strlen( opt.ca_file ) )
        if( strcmp( opt.ca_file, "none" ) == 0 )
            ret = 0;
        else
            ret = mbedtls_x509_crt_parse_file( &cacert, opt.ca_file );
    else
#endif
#if defined(MBEDTLS_CERTS_C)
        for( i = 0; mbedtls_test_cas[i] != NULL; i++ )
        {
            ret = mbedtls_x509_crt_parse( &cacert,
                                  (const unsigned char *) mbedtls_test_cas[i],
                                  mbedtls_test_cas_len[i] );
            if( ret != 0 )
                break;
        }
#else
    {
        ret = 1;
        mbedtls_printf("MBEDTLS_CERTS_C not defined.");
    }
#endif
    if( ret < 0 )
    {
        mbedtls_printf( " failed\n  !  mbedtls_x509_crt_parse returned -0x%x\n\n", -ret );
        goto exit;
    }

    mbedtls_printf( " ok (%d skipped)\n", ret );

    /*
     * 1.2. Load own certificate and private key
     *
     * (can be skipped if client authentication is not required)
     */
    mbedtls_printf( "  . Loading the client cert. and key..." );
    fflush( stdout );

#if defined(MBEDTLS_FS_IO)
    if( strlen( opt.crt_file ) )
        if( strcmp( opt.crt_file, "none" ) == 0 )
            ret = 0;
        else
            ret = mbedtls_x509_crt_parse_file( &clicert, opt.crt_file );
    else
#endif
#if defined(MBEDTLS_CERTS_C)
        ret = mbedtls_x509_crt_parse( &clicert, (const unsigned char *) mbedtls_test_cli_crt,
                mbedtls_test_cli_crt_len );
#else
    {
        ret = 1;
        mbedtls_printf("MBEDTLS_CERTS_C not defined.");
    }
#endif
    if( ret != 0 )
    {
        mbedtls_printf( " failed\n  !  mbedtls_x509_crt_parse returned -0x%x\n\n", -ret );
        goto exit;
    }

#if defined(MBEDTLS_FS_IO)
    if( strlen( opt.key_file ) )
        if( strcmp( opt.key_file, "none" ) == 0 )
            ret = 0;
        else
            ret = mbedtls_pk_parse_keyfile( &pkey, opt.key_file, "" );
    else
#endif
#if defined(MBEDTLS_CERTS_C)
        ret = mbedtls_pk_parse_key( &pkey, (const unsigned char *) mbedtls_test_cli_key,
                mbedtls_test_cli_key_len, NULL, 0 );
#else
    {
        ret = 1;
        mbedtls_printf("MBEDTLS_CERTS_C not defined.");
    }
#endif
    if( ret != 0 )
    {
        mbedtls_printf( " failed\n  !  mbedtls_pk_parse_key returned -0x%x\n\n", -ret );
        goto exit;
    }

    mbedtls_printf( " ok\n" );
#endif /* MBEDTLS_X509_CRT_PARSE_C */

    /*
     * 2. Start the connection
     */
    if( opt.server_addr == NULL)
        opt.server_addr = opt.server_name;

    mbedtls_printf( "  . Connecting to %s/%s/%s...",
            opt.transport == MBEDTLS_SSL_TRANSPORT_STREAM ? "tcp" : "udp",
            opt.server_addr, opt.server_port );
    fflush( stdout );

    if( ( ret = mbedtls_net_connect( &server_fd, opt.server_addr, opt.server_port,
                             opt.transport == MBEDTLS_SSL_TRANSPORT_STREAM ?
                             MBEDTLS_NET_PROTO_TCP : MBEDTLS_NET_PROTO_UDP ) ) != 0 )
    {
        mbedtls_printf( " failed\n  ! mbedtls_net_connect returned -0x%x\n\n", -ret );
        goto exit;
    }

    if( opt.nbio > 0 )
        ret = mbedtls_net_set_nonblock( &server_fd );
    else
        ret = mbedtls_net_set_block( &server_fd );
    if( ret != 0 )
    {
        mbedtls_printf( " failed\n  ! net_set_(non)block() returned -0x%x\n\n", -ret );
        goto exit;
    }

    mbedtls_printf( " ok\n" );

    /*
     * 3. Setup stuff
     */
    mbedtls_printf( "  . Setting up the SSL/TLS structure..." );
    fflush( stdout );

    if( ( ret = mbedtls_ssl_config_defaults( &conf,
                    MBEDTLS_SSL_IS_CLIENT,
                    opt.transport,
                    MBEDTLS_SSL_PRESET_DEFAULT ) ) != 0 )
    {
        mbedtls_printf( " failed\n  ! mbedtls_ssl_config_defaults returned -0x%x\n\n", -ret );
        goto exit;
    }

#if defined(MBEDTLS_X509_CRT_PARSE_C)
    /* The default algorithms profile disables SHA-1, but our tests still
       rely on it heavily. */
    if( opt.allow_sha1 > 0 )
    {
        crt_profile_for_test.allowed_mds |= MBEDTLS_X509_ID_FLAG( MBEDTLS_MD_SHA1 );
        mbedtls_ssl_conf_cert_profile( &conf, &crt_profile_for_test );
        mbedtls_ssl_conf_sig_hashes( &conf, ssl_sig_hashes_for_test );
    }

    if( opt.debug_level > 0 )
        mbedtls_ssl_conf_verify( &conf, my_verify, NULL );
#endif /* MBEDTLS_X509_CRT_PARSE_C */

    if( opt.auth_mode != DFL_AUTH_MODE )
        mbedtls_ssl_conf_authmode( &conf, opt.auth_mode );

#if defined(MBEDTLS_SSL_PROTO_DTLS)
    if( opt.hs_to_min != DFL_HS_TO_MIN || opt.hs_to_max != DFL_HS_TO_MAX )
        mbedtls_ssl_conf_handshake_timeout( &conf, opt.hs_to_min, opt.hs_to_max );
#endif /* MBEDTLS_SSL_PROTO_DTLS */

#if defined(MBEDTLS_SSL_MAX_FRAGMENT_LENGTH)
    if( ( ret = mbedtls_ssl_conf_max_frag_len( &conf, opt.mfl_code ) ) != 0 )
    {
        mbedtls_printf( " failed\n  ! mbedtls_ssl_conf_max_frag_len returned %d\n\n", ret );
        goto exit;
    }
#endif

#if defined(MBEDTLS_SSL_TRUNCATED_HMAC)
    if( opt.trunc_hmac != DFL_TRUNC_HMAC )
        mbedtls_ssl_conf_truncated_hmac( &conf, opt.trunc_hmac );
#endif

#if defined(MBEDTLS_SSL_EXTENDED_MASTER_SECRET)
    if( opt.extended_ms != DFL_EXTENDED_MS )
        mbedtls_ssl_conf_extended_master_secret( &conf, opt.extended_ms );
#endif

#if defined(MBEDTLS_SSL_ENCRYPT_THEN_MAC)
    if( opt.etm != DFL_ETM )
        mbedtls_ssl_conf_encrypt_then_mac( &conf, opt.etm );
#endif

#if defined(MBEDTLS_SSL_CBC_RECORD_SPLITTING)
    if( opt.recsplit != DFL_RECSPLIT )
        mbedtls_ssl_conf_cbc_record_splitting( &conf, opt.recsplit
                                    ? MBEDTLS_SSL_CBC_RECORD_SPLITTING_ENABLED
                                    : MBEDTLS_SSL_CBC_RECORD_SPLITTING_DISABLED );
#endif

#if defined(MBEDTLS_DHM_C)
    if( opt.dhmlen != DFL_DHMLEN )
        mbedtls_ssl_conf_dhm_min_bitlen( &conf, opt.dhmlen );
#endif

#if defined(MBEDTLS_SSL_ALPN)
    if( opt.alpn_string != NULL )
        if( ( ret = mbedtls_ssl_conf_alpn_protocols( &conf, alpn_list ) ) != 0 )
        {
            mbedtls_printf( " failed\n  ! mbedtls_ssl_conf_alpn_protocols returned %d\n\n", ret );
            goto exit;
        }
#endif

    mbedtls_ssl_conf_rng( &conf, mbedtls_ctr_drbg_random, &ctr_drbg );
    mbedtls_ssl_conf_dbg( &conf, my_debug, stdout );

    mbedtls_ssl_conf_read_timeout( &conf, opt.read_timeout );

#if defined(MBEDTLS_SSL_SESSION_TICKETS)
    mbedtls_ssl_conf_session_tickets( &conf, opt.tickets );
#endif

    if( opt.force_ciphersuite[0] != DFL_FORCE_CIPHER )
        mbedtls_ssl_conf_ciphersuites( &conf, opt.force_ciphersuite );

#if defined(MBEDTLS_ARC4_C)
    if( opt.arc4 != DFL_ARC4 )
        mbedtls_ssl_conf_arc4_support( &conf, opt.arc4 );
#endif

    if( opt.allow_legacy != DFL_ALLOW_LEGACY )
        mbedtls_ssl_conf_legacy_renegotiation( &conf, opt.allow_legacy );
#if defined(MBEDTLS_SSL_RENEGOTIATION)
    mbedtls_ssl_conf_renegotiation( &conf, opt.renegotiation );
#endif

#if defined(MBEDTLS_X509_CRT_PARSE_C)
    if( strcmp( opt.ca_path, "none" ) != 0 &&
        strcmp( opt.ca_file, "none" ) != 0 )
    {
        mbedtls_ssl_conf_ca_chain( &conf, &cacert, NULL );
    }
    if( strcmp( opt.crt_file, "none" ) != 0 &&
        strcmp( opt.key_file, "none" ) != 0 )
    {
        if( ( ret = mbedtls_ssl_conf_own_cert( &conf, &clicert, &pkey ) ) != 0 )
        {
            mbedtls_printf( " failed\n  ! mbedtls_ssl_conf_own_cert returned %d\n\n", ret );
            goto exit;
        }
    }
#endif

#if defined(MBEDTLS_ECP_C)
    if( opt.curves != NULL &&
        strcmp( opt.curves, "default" ) != 0 )
    {
        mbedtls_ssl_conf_curves( &conf, curve_list );
    }
#endif

#if defined(MBEDTLS_KEY_EXCHANGE__SOME__PSK_ENABLED)
    if( ( ret = mbedtls_ssl_conf_psk( &conf, psk, psk_len,
                             (const unsigned char *) opt.psk_identity,
                             strlen( opt.psk_identity ) ) ) != 0 )
    {
        mbedtls_printf( " failed\n  ! mbedtls_ssl_conf_psk returned %d\n\n", ret );
        goto exit;
    }
#endif

    if( opt.min_version != DFL_MIN_VERSION )
        mbedtls_ssl_conf_min_version( &conf, MBEDTLS_SSL_MAJOR_VERSION_3, opt.min_version );

    if( opt.max_version != DFL_MAX_VERSION )
        mbedtls_ssl_conf_max_version( &conf, MBEDTLS_SSL_MAJOR_VERSION_3, opt.max_version );

#if defined(MBEDTLS_SSL_FALLBACK_SCSV)
    if( opt.fallback != DFL_FALLBACK )
        mbedtls_ssl_conf_fallback( &conf, opt.fallback );
#endif

    if( ( ret = mbedtls_ssl_setup( &ssl, &conf ) ) != 0 )
    {
        mbedtls_printf( " failed\n  ! mbedtls_ssl_setup returned -0x%x\n\n", -ret );
        goto exit;
    }

#if defined(MBEDTLS_X509_CRT_PARSE_C)
    if( ( ret = mbedtls_ssl_set_hostname( &ssl, opt.server_name ) ) != 0 )
    {
        mbedtls_printf( " failed\n  ! mbedtls_ssl_set_hostname returned %d\n\n", ret );
        goto exit;
    }
#endif

#if defined(MBEDTLS_KEY_EXCHANGE_ECJPAKE_ENABLED)
    if( opt.ecjpake_pw != DFL_ECJPAKE_PW )
    {
        if( ( ret = mbedtls_ssl_set_hs_ecjpake_password( &ssl,
                        (const unsigned char *) opt.ecjpake_pw,
                                        strlen( opt.ecjpake_pw ) ) ) != 0 )
        {
            mbedtls_printf( " failed\n  ! mbedtls_ssl_set_hs_ecjpake_password returned %d\n\n", ret );
            goto exit;
        }
    }
#endif

    if( opt.nbio == 2 )
        mbedtls_ssl_set_bio( &ssl, &server_fd, my_send, my_recv, NULL );
    else
        mbedtls_ssl_set_bio( &ssl, &server_fd, mbedtls_net_send, mbedtls_net_recv,
                             opt.nbio == 0 ? mbedtls_net_recv_timeout : NULL );

#if defined(MBEDTLS_TIMING_C)
    mbedtls_ssl_set_timer_cb( &ssl, &timer, mbedtls_timing_set_delay,
                                            mbedtls_timing_get_delay );
#endif

    mbedtls_printf( " ok\n" );

    /*
     * 4. Handshake
     */
    mbedtls_printf( "  . Performing the SSL/TLS handshake..." );
    fflush( stdout );

    while( ( ret = mbedtls_ssl_handshake( &ssl ) ) != 0 )
    {
        if( ret != MBEDTLS_ERR_SSL_WANT_READ && ret != MBEDTLS_ERR_SSL_WANT_WRITE )
        {
            mbedtls_printf( " failed\n  ! mbedtls_ssl_handshake returned -0x%x\n", -ret );
            if( ret == MBEDTLS_ERR_X509_CERT_VERIFY_FAILED )
                mbedtls_printf(
                    "    Unable to verify the server's certificate. "
                        "Either it is invalid,\n"
                    "    or you didn't set ca_file or ca_path "
                        "to an appropriate value.\n"
                    "    Alternatively, you may want to use "
                        "auth_mode=optional for testing purposes.\n" );
            mbedtls_printf( "\n" );
            goto exit;
        }
    }

    mbedtls_printf( " ok\n    [ Protocol is %s ]\n    [ Ciphersuite is %s ]\n",
            mbedtls_ssl_get_version( &ssl ), mbedtls_ssl_get_ciphersuite( &ssl ) );

    if( ( ret = mbedtls_ssl_get_record_expansion( &ssl ) ) >= 0 )
        mbedtls_printf( "    [ Record expansion is %d ]\n", ret );
    else
        mbedtls_printf( "    [ Record expansion is unknown (compression) ]\n" );

#if defined(MBEDTLS_SSL_MAX_FRAGMENT_LENGTH)
    mbedtls_printf( "    [ Maximum fragment length is %u ]\n",
                    (unsigned int) mbedtls_ssl_get_max_frag_len( &ssl ) );
#endif

#if defined(MBEDTLS_SSL_ALPN)
    if( opt.alpn_string != NULL )
    {
        const char *alp = mbedtls_ssl_get_alpn_protocol( &ssl );
        mbedtls_printf( "    [ Application Layer Protocol is %s ]\n",
                alp ? alp : "(none)" );
    }
#endif

    if( opt.reconnect != 0 )
    {
        mbedtls_printf("  . Saving session for reuse..." );
        fflush( stdout );

        if( ( ret = mbedtls_ssl_get_session( &ssl, &saved_session ) ) != 0 )
        {
            mbedtls_printf( " failed\n  ! mbedtls_ssl_get_session returned -0x%x\n\n", -ret );
            goto exit;
        }

        mbedtls_printf( " ok\n" );
    }

#if defined(MBEDTLS_X509_CRT_PARSE_C)
    /*
     * 5. Verify the server certificate
     */
    mbedtls_printf( "  . Verifying peer X.509 certificate..." );

    if( ( flags = mbedtls_ssl_get_verify_result( &ssl ) ) != 0 )
    {
        char vrfy_buf[512];

        mbedtls_printf( " failed\n" );

        mbedtls_x509_crt_verify_info( vrfy_buf, sizeof( vrfy_buf ), "  ! ", flags );

        mbedtls_printf( "%s\n", vrfy_buf );
    }
    else
        mbedtls_printf( " ok\n" );

    if( mbedtls_ssl_get_peer_cert( &ssl ) != NULL )
    {
        mbedtls_printf( "  . Peer certificate information    ...\n" );
        mbedtls_x509_crt_info( (char *) buf, sizeof( buf ) - 1, "      ",
                       mbedtls_ssl_get_peer_cert( &ssl ) );
        mbedtls_printf( "%s\n", buf );
    }
#endif /* MBEDTLS_X509_CRT_PARSE_C */

#if defined(MBEDTLS_SSL_RENEGOTIATION)
    if( opt.renegotiate )
    {
        /*
         * Perform renegotiation (this must be done when the server is waiting
         * for input from our side).
         */
        mbedtls_printf( "  . Performing renegotiation..." );
        fflush( stdout );
        while( ( ret = mbedtls_ssl_renegotiate( &ssl ) ) != 0 )
        {
            if( ret != MBEDTLS_ERR_SSL_WANT_READ &&
                ret != MBEDTLS_ERR_SSL_WANT_WRITE )
            {
                mbedtls_printf( " failed\n  ! mbedtls_ssl_renegotiate returned %d\n\n", ret );
                goto exit;
            }
        }
        mbedtls_printf( " ok\n" );
    }
#endif /* MBEDTLS_SSL_RENEGOTIATION */

    /*
     * 6. Write the GET request
     */
    retry_left = opt.max_resend;
send_request:
    mbedtls_printf( "  > Write to server:" );
    fflush( stdout );
    Temp = GET_REQUEST;
	len = 0;
	len += sprintf(buf+len, "POST /devices/X2Pro/messages/events?api-version=2016-11-14 HTTP/1.1\r\n");
    len += sprintf(buf+len, "Host: iotdemo-1-maestrotek.azure-devices.net\r\n");
    len += sprintf(buf+len, "Authorization: SharedAccessSignature sr=iotdemo-1-maestrotek.azure-devices.net&sig=KdKCBFf9RsCjdzmyp5MZRF2pFIZajM92GlPiI824BV4%%3D&se=1550044471&skn=iothubowner\r\n");
    len += sprintf(buf+len, "Server: Microsoft-HTTPAPI/2.0\r\n");
	len += sprintf(buf+len, "Content-Type: application/json\r\n");
	len += sprintf(buf+len, "Content-Length: 5\r\n");
	len += sprintf(buf+len, "\n");
	len += sprintf(buf+len, "Hello\r\n");

    /*len = mbedtls_snprintf( (char *) buf, sizeof( buf ) - 1, GET_REQUEST,
                            opt.request_page );*/
    tail_len = (int) strlen( GET_REQUEST_END );

    /* Add padding to GET request to reach opt.request_size in length */
    if( opt.request_size != DFL_REQUEST_SIZE &&
        len + tail_len < opt.request_size )
    {
        memset( buf + len, 'A', opt.request_size - len - tail_len );
        len += opt.request_size - len - tail_len;
    }

    strncpy( (char *) buf + len, GET_REQUEST_END, sizeof( buf ) - len - 1 );
    len += tail_len;

    /* Truncate if request size is smaller than the "natural" size */
    if( opt.request_size != DFL_REQUEST_SIZE &&
        len > opt.request_size )
    {
        len = opt.request_size;

        /* Still end with \r\n unless that's really not possible */
        if( len >= 2 ) buf[len - 2] = '\r';
        if( len >= 1 ) buf[len - 1] = '\n';
    }

    if( opt.transport == MBEDTLS_SSL_TRANSPORT_STREAM )
    {
        for( written = 0, frags = 0; written < len; written += ret, frags++ )
        {
            while( ( ret = mbedtls_ssl_write( &ssl, buf + written, len - written ) )
                           <= 0 )
            {
                if( ret != MBEDTLS_ERR_SSL_WANT_READ &&
                    ret != MBEDTLS_ERR_SSL_WANT_WRITE )
                {
                    mbedtls_printf( " failed\n  ! mbedtls_ssl_write returned -0x%x\n\n", -ret );
                    goto exit;
                }
            }
        }
    }
    else /* Not stream, so datagram */
    {
        do ret = mbedtls_ssl_write( &ssl, buf, len );
        while( ret == MBEDTLS_ERR_SSL_WANT_READ ||
               ret == MBEDTLS_ERR_SSL_WANT_WRITE );

        if( ret < 0 )
        {
            mbedtls_printf( " failed\n  ! mbedtls_ssl_write returned %d\n\n", ret );
            goto exit;
        }

        frags = 1;
        written = ret;

        if( written < len )
        {
            mbedtls_printf( " warning\n  ! request didn't fit into single datagram and "
                            "was truncated to size %u", (unsigned) written );
        }
    }

    buf[written] = '\0';
    mbedtls_printf( " %d bytes written in %d fragments\n\n%s\n", written, frags, (char *) buf );

    /*
     * 7. Read the HTTP response
     */
    mbedtls_printf( "  < Read from server:" );
    fflush( stdout );

    /*
     * TLS and DTLS need different reading styles (stream vs datagram)
     */
    if( opt.transport == MBEDTLS_SSL_TRANSPORT_STREAM )
    {
        do
        {
            len = sizeof( buf ) - 1;
            memset( buf, 0, sizeof( buf ) );
            ret = mbedtls_ssl_read( &ssl, buf, len );

            if( ret == MBEDTLS_ERR_SSL_WANT_READ ||
                ret == MBEDTLS_ERR_SSL_WANT_WRITE )
                continue;

            if( ret <= 0 )
            {
                switch( ret )
                {
                    case MBEDTLS_ERR_SSL_PEER_CLOSE_NOTIFY:
                        mbedtls_printf( " connection was closed gracefully\n" );
                        ret = 0;
                        goto close_notify;

                    case 0:
                    case MBEDTLS_ERR_NET_CONN_RESET:
                        mbedtls_printf( " connection was reset by peer\n" );
                        ret = 0;
                        goto reconnect;

                    default:
                        mbedtls_printf( " mbedtls_ssl_read returned -0x%x\n", -ret );
                        goto exit;
                }
            }

            len = ret;
            buf[len] = '\0';
            mbedtls_printf( " %d bytes read\n\n%s", len, (char *) buf );

            /* End of message should be detected according to the syntax of the
             * application protocol (eg HTTP), just use a dummy test here. */
            if( ret > 0 && buf[len-1] == '\n' )
            {
                ret = 0;
                break;
            }
        }
        while( 1 );
    }
    else /* Not stream, so datagram */
    {
        len = sizeof( buf ) - 1;
        memset( buf, 0, sizeof( buf ) );

        do ret = mbedtls_ssl_read( &ssl, buf, len );
        while( ret == MBEDTLS_ERR_SSL_WANT_READ ||
               ret == MBEDTLS_ERR_SSL_WANT_WRITE );

        if( ret <= 0 )
        {
            switch( ret )
            {
                case MBEDTLS_ERR_SSL_TIMEOUT:
                    mbedtls_printf( " timeout\n" );
                    if( retry_left-- > 0 )
                        goto send_request;
                    goto exit;

                case MBEDTLS_ERR_SSL_PEER_CLOSE_NOTIFY:
                    mbedtls_printf( " connection was closed gracefully\n" );
                    ret = 0;
                    goto close_notify;

                default:
                    mbedtls_printf( " mbedtls_ssl_read returned -0x%x\n", -ret );
                    goto exit;
            }
        }

        len = ret;
        buf[len] = '\0';
        mbedtls_printf( " %d bytes read\n\n%s", len, (char *) buf );
        ret = 0;
    }

    /*
     * 7b. Simulate hard reset and reconnect from same port?
     */
    if( opt.reconnect_hard != 0 )
    {
        opt.reconnect_hard = 0;

        mbedtls_printf( "  . Restarting connection from same port..." );
        fflush( stdout );

        if( ( ret = mbedtls_ssl_session_reset( &ssl ) ) != 0 )
        {
            mbedtls_printf( " failed\n  ! mbedtls_ssl_session_reset returned -0x%x\n\n", -ret );
            goto exit;
        }

        while( ( ret = mbedtls_ssl_handshake( &ssl ) ) != 0 )
        {
            if( ret != MBEDTLS_ERR_SSL_WANT_READ &&
                ret != MBEDTLS_ERR_SSL_WANT_WRITE )
            {
                mbedtls_printf( " failed\n  ! mbedtls_ssl_handshake returned -0x%x\n\n", -ret );
                goto exit;
            }
        }

        mbedtls_printf( " ok\n" );

        goto send_request;
    }

    /*
     * 7c. Continue doing data exchanges?
     */
    if( --opt.exchanges > 0 )
        goto send_request;

    /*
     * 8. Done, cleanly close the connection
     */
close_notify:
    mbedtls_printf( "  . Closing the connection..." );
    fflush( stdout );

    /* No error checking, the connection might be closed already */
    do ret = mbedtls_ssl_close_notify( &ssl );
    while( ret == MBEDTLS_ERR_SSL_WANT_WRITE );
    ret = 0;

    mbedtls_printf( " done\n" );

    /*
     * 9. Reconnect?
     */
reconnect:
    if( opt.reconnect != 0 )
    {
        --opt.reconnect;

        mbedtls_net_free( &server_fd );

#if defined(MBEDTLS_TIMING_C)
        if( opt.reco_delay > 0 )
            mbedtls_net_usleep( 1000000 * opt.reco_delay );
#endif

        mbedtls_printf( "  . Reconnecting with saved session..." );

        if( ( ret = mbedtls_ssl_session_reset( &ssl ) ) != 0 )
        {
            mbedtls_printf( " failed\n  ! mbedtls_ssl_session_reset returned -0x%x\n\n", -ret );
            goto exit;
        }

        if( ( ret = mbedtls_ssl_set_session( &ssl, &saved_session ) ) != 0 )
        {
            mbedtls_printf( " failed\n  ! mbedtls_ssl_conf_session returned %d\n\n", ret );
            goto exit;
        }

        if( ( ret = mbedtls_net_connect( &server_fd, opt.server_addr, opt.server_port,
                                 opt.transport == MBEDTLS_SSL_TRANSPORT_STREAM ?
                                 MBEDTLS_NET_PROTO_TCP : MBEDTLS_NET_PROTO_UDP ) ) != 0 )
        {
            mbedtls_printf( " failed\n  ! mbedtls_net_connect returned -0x%x\n\n", -ret );
            goto exit;
        }

        if( opt.nbio > 0 )
            ret = mbedtls_net_set_nonblock( &server_fd );
        else
            ret = mbedtls_net_set_block( &server_fd );
        if( ret != 0 )
        {
            mbedtls_printf( " failed\n  ! net_set_(non)block() returned -0x%x\n\n",
                    -ret );
            goto exit;
        }

        while( ( ret = mbedtls_ssl_handshake( &ssl ) ) != 0 )
        {
            if( ret != MBEDTLS_ERR_SSL_WANT_READ &&
                ret != MBEDTLS_ERR_SSL_WANT_WRITE )
            {
                mbedtls_printf( " failed\n  ! mbedtls_ssl_handshake returned -0x%x\n\n", -ret );
                goto exit;
            }
        }

        mbedtls_printf( " ok\n" );

        goto send_request;
    }

    /*
     * Cleanup and exit
     */
exit:
#ifdef MBEDTLS_ERROR_C
    if( ret != 0 )
    {
        char error_buf[100];
        mbedtls_strerror( ret, error_buf, 100 );
        mbedtls_printf("Last error was: -0x%X - %s\n\n", -ret, error_buf );
    }
#endif

    mbedtls_net_free( &server_fd );

#if defined(MBEDTLS_X509_CRT_PARSE_C)
    mbedtls_x509_crt_free( &clicert );
    mbedtls_x509_crt_free( &cacert );
    mbedtls_pk_free( &pkey );
#endif
    mbedtls_ssl_session_free( &saved_session );
    mbedtls_ssl_free( &ssl );
    mbedtls_ssl_config_free( &conf );
    mbedtls_ctr_drbg_free( &ctr_drbg );
    mbedtls_entropy_free( &entropy );

#if defined(_WIN32)
    mbedtls_printf( "  + Press Enter to exit this program.\n" );
    fflush( stdout ); getchar();
#endif

    // Shell can not handle large exit numbers -> 1 for errors
    if( ret < 0 )
        ret = 1;

    return( ret );
}
#endif /* MBEDTLS_BIGNUM_C && MBEDTLS_ENTROPY_C && MBEDTLS_SSL_TLS_C &&
          MBEDTLS_SSL_CLI_C && MBEDTLS_NET_C && MBEDTLS_RSA_C &&
          MBEDTLS_CTR_DRBG_C MBEDTLS_TIMING_C */
